<?xml version="1.0" encoding="UTF-8"?>
<!DOCTYPE SPEC SYSTEM "../dat/SPEC.dtd">
<SPEC>
	<MODULE>
		<MTYPE>
			<NAME VALUE="SEMA0" />
			<NAME VALUE="SEMA1" />
		</MTYPE>
	</MODULE>



	<MODULE>
		<PROCTYPE>
			<NAME VALUE="DIJKSTRA" />
			<SEQUENCE>
				<STEP>
					<DECLLIST>
						<DECL>
							<TYPENAME>
								<NUM />
							</TYPENAME>
							<IVAR>
								<NAME VALUE="COUNT" />
							</IVAR>
						</DECL>
					</DECLLIST>
				</STEP>
				<STEP>
					<STMT>
						<ASSIGN>
							<VARREF>
								<NAME VALUE="COUNT" />
							</VARREF>
							<EXPR>
								<VARREF>
									<NAME VALUE="1,0" />
								</VARREF>
							</EXPR>
						</ASSIGN>
					</STMT>
				</STEP>
				<STEP>
					<STMT>
						<DO>
							<OPTION>
								<SEQUENCE>
									<STEP>
										<STMT>
											<SEND>
												<NAME VALUE="SEMA0" />
											</SEND>
										</STMT>
									</STEP>
									<STEP>
										<STMT>
											<RECEIVE>
												<NAME VALUE="SEMA1" />
											</RECEIVE>
										</STMT>
									</STEP>
								</SEQUENCE>
							</OPTION>
						</DO>
					</STMT>
				</STEP>
			</SEQUENCE>
		</PROCTYPE>
	</MODULE>



	<MODULE>
		<PROCTYPE>
			<NAME VALUE="MONITOR" />
			<SEQUENCE>
				<STEP>
					<STMT>
						<ASSERT EVAL="TRUE" LABEL="L1" VARUSE="COUNT">
							<EXPR>
								<VARREF>
									<NAME VALUE="COUNT" />
								</VARREF>
								<OP VALUE="==" />
								<CONST VALUE="1 OR 0" />
							</EXPR>
						</ASSERT>
					</STMT>
				</STEP>
			</SEQUENCE>
		</PROCTYPE>
	</MODULE>

	<MODULE>
		<PROCTYPE>
			<NAME VALUE="USER1" />
			<SEQUENCE>
				<STEP>
					<STMT>
						<RECEIVE>
							<NAME VALUE="SEMA0" />
						</RECEIVE>
					</STMT>
				</STEP>
				<STEP>
					<STMT>
						<ASSIGN EVAL="TRUE" VARUSE="COUNT" LABEL="L2">
							<VARREF>
								<NAME VALUE="COUNT" />
							</VARREF>
							<EXPR>
								<VARREF>
									<NAME VALUE="1,COUNT" />
								</VARREF>
								<OP VALUE="+" />
								<VARREF>
									<NAME VALUE="1,1" />
								</VARREF>
							</EXPR>
						</ASSIGN>
					</STMT>
				</STEP>
				<STEP>
					<STMT>
						<ASSERT EVAL="TRUE" LABEL="L3" VARUSE="COUNT">
							<EXPR>
								<VARREF>
									<NAME VALUE="COUNT" />
								</VARREF>
								<OP VALUE="==" />
								<CONST VALUE="1" />
							</EXPR>
						</ASSERT>
					</STMT>
				</STEP>
				<STEP>
					<STMT>
						<ASSIGN EVAL="TRUE" VARUSE="COUNT" LABEL="L4">
							<VARREF>
								<NAME VALUE="COUNT" />
							</VARREF>
							<EXPR>
								<VARREF>
									<NAME VALUE="1,COUNT" />
								</VARREF>
								<OP VALUE="+" />
								<VARREF>
									<NAME VALUE="1,-1" />
								</VARREF>
							</EXPR>
						</ASSIGN>
					</STMT>
				</STEP>
				<STEP>
					<STMT>
						<SEND>
							<NAME VALUE="SEMA1" />
						</SEND>
					</STMT>
				</STEP>
			</SEQUENCE>
		</PROCTYPE>
	</MODULE>


	<MODULE>
		<PROCTYPE>
			<NAME VALUE="USER2" />
			<SEQUENCE>
				<STEP>
					<STMT>
						<RECEIVE>
							<NAME VALUE="SEMA0" />
						</RECEIVE>
					</STMT>
				</STEP>
				<STEP>
					<STMT>
						<ASSIGN EVAL="TRUE" VARUSE="COUNT" LABEL="L5">
							<VARREF>
								<NAME VALUE="COUNT" />
							</VARREF>
							<EXPR>
								<VARREF>
									<NAME VALUE="1,COUNT" />
								</VARREF>
								<OP VALUE="+" />
								<VARREF>
									<NAME VALUE="1,1" />
								</VARREF>
							</EXPR>
						</ASSIGN>
					</STMT>
				</STEP>
				<STEP>
					<STMT>
						<ASSERT EVAL="TRUE" LABEL="L6" VARUSE="COUNT">
							<EXPR>
								<VARREF>
									<NAME VALUE="COUNT" />
								</VARREF>
								<OP VALUE="==" />
								<CONST VALUE="1" />
							</EXPR>
						</ASSERT>
					</STMT>
				</STEP>
				<STEP>
					<STMT>
						<ASSIGN EVAL="TRUE" VARUSE="COUNT" LABEL="L7">
							<VARREF>
								<NAME VALUE="COUNT" />
							</VARREF>
							<EXPR>
								<VARREF>
									<NAME VALUE="1,COUNT" />
								</VARREF>
								<OP VALUE="+" />
								<VARREF>
									<NAME VALUE="1,-1" />
								</VARREF>
							</EXPR>
						</ASSIGN>
					</STMT>
				</STEP>
				<STEP>
					<STMT>
						<SEND>
							<NAME VALUE="SEMA1" />
						</SEND>
					</STMT>
				</STEP>
			</SEQUENCE>
		</PROCTYPE>
	</MODULE>
</SPEC>