<?xml version="1.0" encoding="UTF-8"?>
<!DOCTYPE SPEC SYSTEM "../dat/SPEC.dtd">
<SPEC>
	<MODULE>
		<MTYPE>
			<NAME VALUE="F" />
			<NAME VALUE="E" />
		</MTYPE>
	</MODULE>
	<MODULE>
		<PROCTYPE>
			<NAME VALUE="MAIN" />
			<SEQUENCE>
				<STEP>
					<DECLLIST>
						<DECL>
							<TYPENAME>
								<NUM />
							</TYPENAME>
							<IVAR>
								<NAME VALUE="X" />
							</IVAR>
						</DECL>
					</DECLLIST>
				</STEP>
				<STEP>
					<STMT>
						<SEND>
							<NAME VALUE="F" />
						</SEND>
					</STMT>
				</STEP>
				<STEP>
					<STMT>
						<SEND>
							<NAME VALUE="" />
						</SEND>
					</STMT>
				</STEP>
				<STEP>
					<STMT>
						<SEND>
							<NAME VALUE="F" />
						</SEND>
					</STMT>
				</STEP>

			</SEQUENCE>
		</PROCTYPE>

	</MODULE>

</SPEC>