<?xml version="1.0" encoding="UTF-8"?>
<!DOCTYPE SPEC SYSTEM "../dat/SPEC.dtd">
<SPEC>
	<MODULE>
		<MTYPE>
			<NAME VALUE="REQ" />
			<NAME VALUE="ACK" />
			<NAME VALUE="REL" />			
		</MTYPE>
	</MODULE>

	<MODULE>
		<PROCTYPE>
			<NAME VALUE="P0" />
			<SEQUENCE>
				<STEP>
					<DECLLIST>
						<DECL>
							<TYPENAME>
								<NUM />
							</TYPENAME>
							<IVAR>
								<NAME VALUE="NCRITICAL" />
							</IVAR>
						</DECL>
					</DECLLIST>
				</STEP>
				<STEP>
					<STMT>
						<ASSIGN>
							<VARREF>
								<NAME VALUE="NCRITICAL" />
							</VARREF>
							<EXPR>
								<VARREF>
									<NAME VALUE="1,0" />
								</VARREF>
							</EXPR>
						</ASSIGN>
					</STMT>
				</STEP>
				<STEP>
					<STMT>
						<DO>
							<OPTION>
								<SEQUENCE>
									<STEP>
										<STMT>
											<RECEIVE>
												<NAME VALUE="REQ" />
											</RECEIVE>
										</STMT>
									</STEP>
									<STEP>
										<STMT>
											<SEND>
												<NAME VALUE="ACK" />
											</SEND>
										</STMT>
									</STEP>
									<STEP>
										<STMT>
											<RECEIVE>
												<NAME VALUE="REL" />
											</RECEIVE>
										</STMT>
									</STEP>
								</SEQUENCE>
							</OPTION>							
						</DO>
					</STMT>
				</STEP>

			</SEQUENCE>
		</PROCTYPE>

	</MODULE>


	<MODULE>
		<PROCTYPE>
			<NAME VALUE="P1" />
			<SEQUENCE>
				<STEP>
					<STMT>
						<DO>
							<OPTION>
								<SEQUENCE>
									<STEP>
										<STMT>
											<SEND>
												<NAME VALUE="REQ" />
											</SEND>
										</STMT>
									</STEP>
									<STEP>
										<STMT>
											<RECEIVE>
												<NAME VALUE="ACK" />
											</RECEIVE>
										</STMT>
									</STEP>
									<STEP>
										<STMT>
											<ASSIGN EVAL="TRUE" VARUSE="NCRITICAL" LABEL="L1">
												<VARREF>
													<NAME VALUE="NCRITICAL" />
												</VARREF>
												<EXPR>
													<VARREF>
														<NAME VALUE="1,NCRITICAL" />
													</VARREF>
													<OP VALUE="+" />
													<VARREF>
														<NAME VALUE="1,1" />
													</VARREF>
												</EXPR>
											</ASSIGN>
										</STMT>
									</STEP>
									<STEP>
										<STMT>
											<ASSERT EVAL="TRUE" VARUSE="NCRITICAL" LABEL="L2">
												<EXPR>
													<VARREF>
														<NAME VALUE="NCRITICAL" />
													</VARREF>
													<OP VALUE="=" />
													<CONST VALUE="1" />
												</EXPR>
											</ASSERT>
										</STMT>
									</STEP>
									<STEP>
										<STMT>
											<ASSIGN EVAL="TRUE" VARUSE="NCRITICAL" LABEL="L3">
												<VARREF>
													<NAME VALUE="NCRITICAL" />
												</VARREF>
												<EXPR>
													<VARREF>
														<NAME VALUE="1,NCRITICAL" />
													</VARREF>
													<OP VALUE="+" />
													<VARREF>
														<NAME VALUE="1,-1" />
													</VARREF>
												</EXPR>
											</ASSIGN>
										</STMT>
									</STEP>
									<STEP>
										<STMT>
											<SEND>
												<NAME VALUE="REL" />
											</SEND>
										</STMT>
									</STEP>
								</SEQUENCE>
							</OPTION>
						</DO>
					</STMT>
				</STEP>
			</SEQUENCE>
		</PROCTYPE>

	</MODULE>


	<MODULE>
		<PROCTYPE>
			<NAME VALUE="P2" />
			<SEQUENCE>
				<STEP>
					<STMT>
						<DO>
							<OPTION>
								<SEQUENCE>
									<STEP>
										<STMT>
											<SEND>
												<NAME VALUE="REQ" />
											</SEND>
										</STMT>
									</STEP>
									<STEP>
										<STMT>
											<RECEIVE>
												<NAME VALUE="ACK" />
											</RECEIVE>
										</STMT>
									</STEP>
									<STEP>
										<STMT>
											<ASSIGN EVAL="TRUE" VARUSE="NCRITICAL" LABEL="L4">
												<VARREF>
													<NAME VALUE="NCRITICAL" />
												</VARREF>
												<EXPR>
													<VARREF>
														<NAME VALUE="1,NCRITICAL" />
													</VARREF>
													<OP VALUE="+" />
													<VARREF>
														<NAME VALUE="1,1" />
													</VARREF>
												</EXPR>
											</ASSIGN>
										</STMT>
									</STEP>
									<STEP>
										<STMT>
											<ASSERT EVAL="TRUE" VARUSE="NCRITICAL" LABEL="L5">
												<EXPR>
													<VARREF>
														<NAME VALUE="NCRITICAL" />
													</VARREF>
													<OP VALUE="==" />
													<CONST VALUE="1" />
												</EXPR>
											</ASSERT>
										</STMT>
									</STEP>

									<STEP>
										<STMT>
											<ASSIGN EVAL="TRUE" VARUSE="NCRITICAL" LABEL="L6">
												<VARREF>
													<NAME VALUE="NCRITICAL" />
												</VARREF>
												<EXPR>
													<VARREF>
														<NAME VALUE="1,NCRITICAL" />
													</VARREF>
													<OP VALUE="+" />
													<VARREF>
														<NAME VALUE="1,-1" />
													</VARREF>
												</EXPR>
											</ASSIGN>
										</STMT>
									</STEP>
									<STEP>
										<STMT>
											<SEND>
												<NAME VALUE="REL" />
											</SEND>
										</STMT>
									</STEP>
								</SEQUENCE>
							</OPTION>
						</DO>
					</STMT>
				</STEP>
			</SEQUENCE>
		</PROCTYPE>

	</MODULE>

</SPEC>