<?xml version="1.0" encoding="UTF-8"?>
<!DOCTYPE SPEC SYSTEM "../dat/SPEC.dtd">
<SPEC>
	<MODULE>
		<MTYPE>
			<NAME VALUE="START1" />
			<NAME VALUE="START2" />
			<NAME VALUE="DONE1" />
			<NAME VALUE="DONE2" />
		</MTYPE>
	</MODULE>
	<MODULE>
		<PROCTYPE>
			<NAME VALUE="TEST" />
			<SEQUENCE>
				<STEP>
					<DECLLIST>
						<DECL>
							<TYPENAME>
								<NUM />
							</TYPENAME>
							<IVAR>
								<NAME VALUE="JOBDONE1" />
							</IVAR>
						</DECL>
						<DECL>
							<TYPENAME>
								<NUM />
							</TYPENAME>
							<IVAR>
								<NAME VALUE="JOBDONE2" />
							</IVAR>
						</DECL>
					</DECLLIST>
				</STEP>
				<STEP>
					<STMT>
						<ASSIGN>
							<VARREF>
								<NAME VALUE="JOBDONE1" />
							</VARREF>
							<EXPR>
								<VARREF>
									<NAME VALUE="1,0" />
								</VARREF>
							</EXPR>
						</ASSIGN>
					</STMT>
				</STEP>
				<STEP>
					<STMT>
						<ASSIGN>
							<VARREF>
								<NAME VALUE="JOBDONE2" />
							</VARREF>
							<EXPR>
								<VARREF>
									<NAME VALUE="1,0" />
								</VARREF>
							</EXPR>
						</ASSIGN>
					</STMT>
				</STEP>
				<STEP>
					<STMT>
						<IF>
							<OPTION>
								<SEQUENCE>
									<STEP>
										<STMT>
											<SEND>
												<NAME VALUE="START1" />
											</SEND>
										</STMT>
									</STEP>
									<STEP>
										<STMT>
											<SEND>
												<NAME VALUE="START2" />
											</SEND>
										</STMT>
									</STEP>
								</SEQUENCE>
							</OPTION>
							<ELSE>
								<SEQUENCE>
									<STEP>
										<STMT>
											<SEND>
												<NAME VALUE="START2" />
											</SEND>
										</STMT>
									</STEP>
									<STEP>
										<STMT>
											<SEND>
												<NAME VALUE="START1" />
											</SEND>
										</STMT>
									</STEP>
								</SEQUENCE>
							</ELSE>
						</IF>
					</STMT>
				</STEP>
				<STEP>
					<STMT>
						<IF>
							<OPTION>
								<SEQUENCE>
									<STEP>
										<STMT>
											<RECEIVE>
												<NAME VALUE="START1" />
											</RECEIVE>
										</STMT>
									</STEP>
									<STEP>
										<STMT>
											<RECEIVE>
												<NAME VALUE="START2" />
											</RECEIVE>
										</STMT>
									</STEP>
								</SEQUENCE>
							</OPTION>
							<ELSE>
								<SEQUENCE>
									<STEP>
										<STMT>
											<RECEIVE>
												<NAME VALUE="START2" />
											</RECEIVE>
										</STMT>
									</STEP>
									<STEP>
										<STMT>
											<RECEIVE>
												<NAME VALUE="START1" />
											</RECEIVE>
										</STMT>
									</STEP>
								</SEQUENCE>
							</ELSE>
						</IF>
					</STMT>
				</STEP>
				<STEP>
					<STMT>
						<ASSERT LABEL="L1" VARUSE="JOBDONE1" EVAL="TRUE">
							<EXPR>
								<VARREF>
									<NAME VALUE="JOBDONE1" />
								</VARREF>
								<OP VALUE="==" />
								<CONST VALUE="1" />
							</EXPR>
						</ASSERT>
					</STMT>
				</STEP>
				<STEP>
					<STMT>
						<ASSERT LABEL="L2" VARUSE="JOBDONE2" EVAL="TRUE">
							<EXPR>
								<VARREF>
									<NAME VALUE="JOBDONE2" />
								</VARREF>
								<OP VALUE="==" />
								<CONST VALUE="1" />
							</EXPR>
						</ASSERT>
					</STMT>
				</STEP>
			</SEQUENCE>
		</PROCTYPE>
	</MODULE>

	<MODULE>
		<PROCTYPE>
			<NAME VALUE="JOB1" />
			<SEQUENCE>
				<STEP>
					<STMT>
						<RECEIVE>
							<NAME VALUE="START1" />
						</RECEIVE>
					</STMT>
				</STEP>
				<!-- FAST PROCESS -->
				<STEP>
					<STMT>
						<ASSIGN>
							<VARREF>
								<NAME VALUE="JOBDONE1" />
							</VARREF>
							<EXPR>
								<VARREF>
									<NAME VALUE="1,1" />
								</VARREF>
							</EXPR>
						</ASSIGN>
					</STMT>
				</STEP>
				<STEP>
					<STMT>
						<SEND>
							<NAME VALUE="DONE1" />
						</SEND>
					</STMT>
				</STEP>
			</SEQUENCE>
		</PROCTYPE>
	</MODULE>


	<MODULE>
		<PROCTYPE>
			<NAME VALUE="JOB2" />
			<SEQUENCE>
				<STEP>
					<STMT>
						<RECEIVE>
							<NAME VALUE="START2" />
						</RECEIVE>
					</STMT>
				</STEP>
				<!-- SLOW PROCESS -->
				<STEP>
					<STMT>
						<DO>
							<OPTION> <!-- NON-DETERMINISTIC DELAY -->
								<SEQUENCE>
									<STEP>
										<STMT>
											<EXPR>
												<CONST VALUE="1" />
											</EXPR>
										</STMT>
									</STEP>
								</SEQUENCE>
							</OPTION>
							<OPTION> 
								<SEQUENCE>
									<STEP>
										<STMT>
											<BREAK />
										</STMT>
									</STEP>
								</SEQUENCE>
							</OPTION>
						</DO>
					</STMT>
				</STEP>
				<STEP>
					<STMT>
						<ASSIGN>
							<VARREF>
								<NAME VALUE="JOBDONE2" />
							</VARREF>
							<EXPR>
								<VARREF>
									<NAME VALUE="1,1" />
								</VARREF>
							</EXPR>
						</ASSIGN>
					</STMT>
				</STEP>
				<STEP>
					<STMT>
						<SEND>
							<NAME VALUE="DONE2" />
						</SEND>
					</STMT>
				</STEP>
			</SEQUENCE>
		</PROCTYPE>
	</MODULE>


</SPEC>