<?xml version="1.0" encoding="UTF-8"?>
<!DOCTYPE SPEC SYSTEM "../dat/SPEC.dtd">
<SPEC>
	<MODULE>
		<MTYPE>
			<NAME VALUE="CSTART" />
			<NAME VALUE="SSTART" />
			<NAME VALUE="SET5" />
			<NAME VALUE="GET" />
			<NAME VALUE="GETACK" />
			<NAME VALUE="SHUTDOWN" />
		</MTYPE>
	</MODULE>
	<MODULE>
		<PROCTYPE>
			<NAME VALUE="START" />
			<SEQUENCE>
				<STEP>
					<DECLLIST>
						<DECL>
							<TYPENAME>
								<NUM />
							</TYPENAME>
							<IVAR>
								<NAME VALUE="V1" />
							</IVAR>
						</DECL>
						<DECL>
							<TYPENAME>
								<NUM />
							</TYPENAME>
							<IVAR>
								<NAME VALUE="V2" />
							</IVAR>
						</DECL>
						<DECL>
							<TYPENAME>
								<NUM />
							</TYPENAME>
							<IVAR>
								<NAME VALUE="VAL" />
							</IVAR>
						</DECL>
					</DECLLIST>
				</STEP>
				<STEP>
					<STMT>
						<ASSIGN>
							<VARREF>
								<NAME VALUE="V1" />
							</VARREF>
							<EXPR>
								<VARREF>
									<NAME VALUE="1,0" />
								</VARREF>
							</EXPR>
						</ASSIGN>
					</STMT>
				</STEP>
				<STEP>
					<STMT>
						<ASSIGN>
							<VARREF>
								<NAME VALUE="V2" />
							</VARREF>
							<EXPR>
								<VARREF>
									<NAME VALUE="1,0" />
								</VARREF>
							</EXPR>
						</ASSIGN>
					</STMT>
				</STEP>
				<STEP>
					<STMT>
						<ASSIGN>
							<VARREF>
								<NAME VALUE="VAL" />
							</VARREF>
							<EXPR>
								<VARREF>
									<NAME VALUE="1,0" />
								</VARREF>
							</EXPR>
						</ASSIGN>
					</STMT>
				</STEP>
				<STEP>
					<STMT>
						<SEND>
							<NAME VALUE="CSTART" />
						</SEND>
					</STMT>
				</STEP>
				<STEP>
					<STMT>
						<SEND>
							<NAME VALUE="SSTART" />
						</SEND>
					</STMT>
				</STEP>
			</SEQUENCE>
		</PROCTYPE>
	</MODULE>

	<MODULE>
		<PROCTYPE>
			<NAME VALUE="CLIENT" />
			<SEQUENCE>
				<STEP>
					<STMT>
						<RECEIVE>
							<NAME VALUE="CSTART" />
						</RECEIVE>
					</STMT>
				</STEP>
				<STEP>
					<STMT>
						<SEND>
							<NAME VALUE="SET5" />
						</SEND>
					</STMT>
				</STEP>
				<STEP>
					<STMT>
						<SEND>
							<NAME VALUE="GET" />
						</SEND>
					</STMT>
				</STEP>
				<STEP>
					<STMT>
						<RECEIVE>
							<NAME VALUE="GETACK" />
						</RECEIVE>
					</STMT>
				</STEP>
				<STEP>
					<STMT>
						<ASSIGN EVAL="TRUE" LABEL="L1" VARUSE="VAL">
							<VARREF>
								<NAME VALUE="V1" />
							</VARREF>
							<EXPR>
								<VARREF>
									<NAME VALUE="1,VAL" />
								</VARREF>
							</EXPR>
						</ASSIGN>
					</STMT>
				</STEP>
				<STEP>
					<STMT>
						<SEND>
							<NAME VALUE="GET" />
						</SEND>
					</STMT>
				</STEP>
				<STEP>
					<STMT>
						<RECEIVE>
							<NAME VALUE="GETACK" />
						</RECEIVE>
					</STMT>
				</STEP>
				<STEP>
					<STMT>
						<ASSIGN EVAL="TRUE" LABEL="L2" VARUSE="VAL">
							<VARREF>
								<NAME VALUE="V2" />
							</VARREF>
							<EXPR>
								<VARREF>
									<NAME VALUE="1,VAL" />
								</VARREF>
							</EXPR>
						</ASSIGN>
					</STMT>
				</STEP>
				<STEP>
					<STMT>
						<SEND>
							<NAME VALUE="SHUTDOWN" />
						</SEND>
					</STMT>
				</STEP>
				<STEP>
					<STMT>
						<ASSERT EVAL="TRUE" VARUSE="V1,V2" LABEL="L3">
							<EXPR>
								<VARREF>
									<NAME VALUE="V1" />
								</VARREF>
								<OP VALUE="==" />
								<CONST VALUE="V2" />
							</EXPR>
						</ASSERT>
					</STMT>
				</STEP>
			</SEQUENCE>
		</PROCTYPE>
	</MODULE>

	<MODULE>
		<PROCTYPE>
			<NAME VALUE="SERVER" />
			<SEQUENCE>
				<STEP>
					<STMT>
						<RECEIVE>
							<NAME VALUE="SSTART" />
						</RECEIVE>
					</STMT>
				</STEP>
				<STEP>
					<STMT>
						<DO>
							<OPTION>
								<SEQUENCE>
									<STEP>
										<STMT>
											<RECEIVE>
												<NAME VALUE="SHUTDOWN" />
											</RECEIVE>
										</STMT>
									</STEP>
									<STEP>
										<STMT>
											<BREAK />
										</STMT>
									</STEP>
								</SEQUENCE>
							</OPTION>
							<OPTION>
								<SEQUENCE>
									<STEP>
										<STMT>
											<RECEIVE>
												<NAME VALUE="SET5" />
											</RECEIVE>
										</STMT>
									</STEP>
									<STEP>
										<STMT>
											<ASSIGN>
												<VARREF>
													<NAME VALUE="VAL" />
												</VARREF>
												<EXPR>
													<VARREF>
														<NAME VALUE="1,5" />
													</VARREF>
												</EXPR>
											</ASSIGN>
										</STMT>
									</STEP>
								</SEQUENCE>
							</OPTION>
							<OPTION>
								<SEQUENCE>
									<STEP>
										<STMT>
											<RECEIVE>
												<NAME VALUE="GET" />
											</RECEIVE>
										</STMT>
									</STEP>
									<STEP>
										<STMT>
											<SEND>
												<NAME VALUE="GETACK" />
											</SEND>
										</STMT>
									</STEP>
								</SEQUENCE>
							</OPTION>
						</DO>
					</STMT>
				</STEP>
			</SEQUENCE>
		</PROCTYPE>
	</MODULE>
</SPEC>