<?xml version="1.0" encoding="UTF-8"?>
<!DOCTYPE SPEC SYSTEM "../dat/SPEC.dtd">
<SPEC>
	<MODULE>
		<MTYPE>
			<NAME VALUE="M1" />
		</MTYPE>
	</MODULE>
	<MODULE>
		<PROCTYPE>
			<NAME VALUE="P1" />
			<SEQUENCE>
				<STEP>
					<DECLLIST>
						<DECL>
							<TYPENAME>
								<NUM />
							</TYPENAME>
							<IVAR>
								<NAME VALUE="X" />
							</IVAR>
						</DECL>
						<DECL>
							<TYPENAME>
								<NUM />
							</TYPENAME>
							<IVAR>
								<NAME VALUE="Y" />
							</IVAR>
						</DECL>
					</DECLLIST>
				</STEP>
				<STEP>
					<STMT>
						<ASSIGN>
							<VARREF>
								<NAME VALUE="X" />
							</VARREF>
							<EXPR>
								<VARREF>
									<NAME VALUE="1,1" />
								</VARREF>
							</EXPR>
						</ASSIGN>
					</STMT>
				</STEP>
				<STEP>
					<STMT>
						<SEND>
							<NAME VALUE="M1" />
						</SEND>
					</STMT>
				</STEP>
				<STEP>
					<STMT>
						<ASSERT LABEL="L1" VARUSE="X" EVAL="TRUE">
							<EXPR>
								<VARREF>
									<NAME VALUE="X" />
								</VARREF>
								<OP VALUE="=" />
								<CONST VALUE="1" />
							</EXPR>
						</ASSERT>
					</STMT>
				</STEP>
				<STEP>
					<STMT>
						<SEND>
							<NAME VALUE="M1" />
						</SEND>
					</STMT>
				</STEP>
			</SEQUENCE>
		</PROCTYPE>

	</MODULE>

	<MODULE>
		<PROCTYPE>
			<NAME VALUE="P2" />
			<SEQUENCE>
				<STEP>
					<STMT>
						<RECEIVE>
							<NAME VALUE="M1" />
						</RECEIVE>
					</STMT>
				</STEP>
				<STEP>
					<STMT>
						<ASSIGN>
							<VARREF>
								<NAME VALUE="Y" />
							</VARREF>
							<EXPR>
								<VARREF>
									<NAME VALUE="1,2" />
								</VARREF>
							</EXPR>
						</ASSIGN>
					</STMT>
				</STEP>
				<STEP>
					<STMT>
						<ASSIGN>
							<VARREF>
								<NAME VALUE="X" />
							</VARREF>
							<EXPR>
								<VARREF>
									<NAME VALUE="1,Y" />
								</VARREF>
								<OP VALUE="+" />
								<VARREF>
									<NAME VALUE="1,-1" />
								</VARREF>
							</EXPR>
						</ASSIGN>
					</STMT>
				</STEP>
				<STEP>
					<STMT>
						<RECEIVE>
							<NAME VALUE="M1" />
						</RECEIVE>
					</STMT>
				</STEP>
				<STEP>
					<STMT>
						<ASSIGN>
							<VARREF>
								<NAME VALUE="X" />
							</VARREF>
							<EXPR>
								<VARREF>
									<NAME VALUE="1,3" />
								</VARREF>
							</EXPR>
						</ASSIGN>
					</STMT>
				</STEP>
			</SEQUENCE>
		</PROCTYPE>
	</MODULE>

</SPEC>