<?xml version="1.0" encoding="UTF-8"?>
<!DOCTYPE SPEC SYSTEM "../dat/SPEC.dtd">
<SPEC>
	<MODULE>
		<MTYPE>
			<NAME VALUE="M1" />
		</MTYPE>
	</MODULE>
	<MODULE>
		<PROCTYPE>
			<NAME VALUE="P1" />
			<SEQUENCE>
				<STEP>
					<DECLLIST>
						<DECL>
							<TYPENAME>
								<NUM />
							</TYPENAME>
							<IVAR>
								<NAME VALUE="VAR1" />
							</IVAR>
						</DECL>
					</DECLLIST>
				</STEP>
				<STEP>
					<STMT>
						<ASSIGN>
							<VARREF>
								<NAME VALUE="VAR1" />
							</VARREF>
							<EXPR>
								<VARREF>
									<NAME VALUE="1,0" />
								</VARREF>
							</EXPR>
						</ASSIGN>
					</STMT>
				</STEP>
				<STEP>
					<STMT>
						<DO>
							<OPTION>
								<SEQUENCE>
									<STEP>
										<STMT>
											<RECEIVE>
												<NAME VALUE="M1" />
											</RECEIVE>
										</STMT>
									</STEP>
									<STEP>
										<STMT>
											<ASSIGN EVAL="TRUE" LABEL="L1" VARUSE="VAR1">
												<VARREF>
													<NAME VALUE="VAR1" />
												</VARREF>
												<EXPR>
													<VARREF>
														<NAME VALUE="1,VAR1" />
													</VARREF>
													<OP VALUE="+" />
													<VARREF>
														<NAME VALUE="1,1" />
													</VARREF>
												</EXPR>
											</ASSIGN>
										</STMT>
									</STEP>

								</SEQUENCE>
							</OPTION>
							<OPTION>
								<SEQUENCE>
									<STEP>
										<STMT>
											<BREAK />
										</STMT>
									</STEP>
								</SEQUENCE>
							</OPTION>
						</DO>
					</STMT>
				</STEP>
			</SEQUENCE>
		</PROCTYPE>
	</MODULE>
</SPEC>